{
  "id": "BOB-01-2020",
  "name": "Amphan",
  "season_year": 2020,
  "basin": "Bay of Bengal",
  "current_status": "Super Cyclonic Storm",
  "genesis_time": "2020-05-16T06:00:00Z",
  "dissipation_time": "2020-05-21T12:00:00Z",
  "track_points": [
    {
      "timestamp": "2020-05-16T06:00:00Z",
      "latitude": 10.4,
      "longitude": 86.4,
      "wind_speed_knots": 30,
      "wind_speed_kmph": 55,
      "gust_speed_kmph": 75,
      "central_pressure_hpa": 1000,
      "category": "Deep Depression",
      "is_forecast": false,
      "forecast_lead_hours": 0,
      "cone_radius_km": 0,
      "heading_degrees": 350,
      "forward_speed_kmph": 10
    },
    {
      "timestamp": "2020-05-16T18:00:00Z",
      "latitude": 11.2,
      "longitude": 86.2,
      "wind_speed_knots": 40,
      "wind_speed_kmph": 75,
      "gust_speed_kmph": 95,
      "central_pressure_hpa": 994,
      "category": "Cyclonic Storm",
      "is_forecast": false,
      "forecast_lead_hours": 0,
      "cone_radius_km": 0,
      "heading_degrees": 350,
      "forward_speed_kmph": 11
    },
    {
      "timestamp": "2020-05-17T12:00:00Z",
      "latitude": 12.5,
      "longitude": 86.4,
      "wind_speed_knots": 60,
      "wind_speed_kmph": 110,
      "gust_speed_kmph": 130,
      "central_pressure_hpa": 982,
      "category": "Severe Cyclonic Storm",
      "is_forecast": false,
      "forecast_lead_hours": 0,
      "cone_radius_km": 0,
      "heading_degrees": 5,
      "forward_speed_kmph": 13
    },
    {
      "timestamp": "2020-05-18T00:00:00Z",
      "latitude": 13.4,
      "longitude": 86.4,
      "wind_speed_knots": 85,
      "wind_speed_kmph": 155,
      "gust_speed_kmph": 180,
      "central_pressure_hpa": 960,
      "category": "Very Severe Cyclonic Storm",
      "is_forecast": false,
      "forecast_lead_hours": 0,
      "cone_radius_km": 0,
      "heading_degrees": 10,
      "forward_speed_kmph": 14
    },
    {
      "timestamp": "2020-05-18T12:00:00Z",
      "latitude": 14.1,
      "longitude": 86.4,
      "wind_speed_knots": 130,
      "wind_speed_kmph": 240,
      "gust_speed_kmph": 265,
      "central_pressure_hpa": 920,
      "category": "Super Cyclonic Storm",
      "is_forecast": false,
      "forecast_lead_hours": 0,
      "cone_radius_km": 0,
      "heading_degrees": 10,
      "forward_speed_kmph": 15
    },
    {
      "timestamp": "2020-05-19T06:00:00Z",
      "latitude": 16.0,
      "longitude": 86.7,
      "wind_speed_knots": 115,
      "wind_speed_kmph": 215,
      "gust_speed_kmph": 240,
      "central_pressure_hpa": 935,
      "category": "Extremely Severe Cyclonic Storm",
      "is_forecast": false,
      "forecast_lead_hours": 0,
      "cone_radius_km": 0,
      "heading_degrees": 15,
      "forward_speed_kmph": 17
    },
    {
      "timestamp": "2020-05-20T00:00:00Z",
      "latitude": 19.2,
      "longitude": 87.7,
      "wind_speed_knots": 95,
      "wind_speed_kmph": 175,
      "gust_speed_kmph": 200,
      "central_pressure_hpa": 950,
      "category": "Extremely Severe Cyclonic Storm",
      "is_forecast": false,
      "forecast_lead_hours": 0,
      "cone_radius_km": 0,
      "heading_degrees": 20,
      "forward_speed_kmph": 22
    },
    {
      "timestamp": "2020-05-20T10:00:00Z",
      "latitude": 21.65,
      "longitude": 88.3,
      "wind_speed_knots": 85,
      "wind_speed_kmph": 155,
      "gust_speed_kmph": 185,
      "central_pressure_hpa": 960,
      "category": "Very Severe Cyclonic Storm",
      "is_forecast": true,
      "forecast_lead_hours": 6,
      "cone_radius_km": 30,
      "heading_degrees": 25,
      "forward_speed_kmph": 25
    },
    {
      "timestamp": "2020-05-20T18:00:00Z",
      "latitude": 22.8,
      "longitude": 88.6,
      "wind_speed_knots": 60,
      "wind_speed_kmph": 110,
      "gust_speed_kmph": 130,
      "central_pressure_hpa": 978,
      "category": "Severe Cyclonic Storm",
      "is_forecast": true,
      "forecast_lead_hours": 14,
      "cone_radius_km": 50,
      "heading_degrees": 30,
      "forward_speed_kmph": 27
    },
    {
      "timestamp": "2020-05-21T06:00:00Z",
      "latitude": 24.5,
      "longitude": 89.2,
      "wind_speed_knots": 35,
      "wind_speed_kmph": 65,
      "gust_speed_kmph": 85,
      "central_pressure_hpa": 994,
      "category": "Cyclonic Storm",
      "is_forecast": true,
      "forecast_lead_hours": 26,
      "cone_radius_km": 75,
      "heading_degrees": 35,
      "forward_speed_kmph": 30
    }
  ]
}
